{
  "schema_version": "1.0",
  "event_id": "6e760be9-c1b7-4e82-973b-a8f421a4c198",
  "timestamp": "2026-08-20T10:00:02Z",
  "camera_id": "cam4",
  "solution_pack": "traffic",
  "application": "wrong_way",
  "event_type": "wrong_way_event",
  "payload": {
    "vehicle_ref": "cam4:run-42:7",
    "vehicle_track_id": 7,
    "vehicle": {
      "ref": "cam4:run-42:7",
      "track_id": 7,
      "camera_id": "cam4",
      "plate": {
        "text": "KA52P1295",
        "confidence": 0.88
      }
    },
    "plate": {
      "text": "KA52P1295",
      "confidence": 0.88
    },
    "snapshot_ref": "snapshots/wrong_way/cam4_vehicle.jpg",
    "snapshot_url": "/snapshots/snapshots/wrong_way/cam4_vehicle.jpg",
    "snapshot_content_type": "image/jpeg",
    "snapshot_assets": {
      "event_frame": {
        "ref": "snapshots/wrong_way/cam4_frame.jpg",
        "url": "/snapshots/snapshots/wrong_way/cam4_frame.jpg",
        "content_type": "image/jpeg"
      },
      "vehicle_crop": {
        "ref": "snapshots/wrong_way/cam4_vehicle.jpg",
        "url": "/snapshots/snapshots/wrong_way/cam4_vehicle.jpg",
        "content_type": "image/jpeg"
      },
      "plate_crop": {
        "ref": "snapshots/wrong_way/cam4_plate.jpg",
        "url": "/snapshots/snapshots/wrong_way/cam4_plate.jpg",
        "content_type": "image/jpeg"
      }
    }
  }
}
